{
  "profile_meta": {
    "trader_code": "trader_a",
    "language": "ru",
    "schema_version": "parser_profile_rules_v1"
  },
  "shared_vocabulary": null,
  "number_format": {
    "decimal_separator": ".",
    "thousands_separator": " "
  },
  "classification_markers": {
    "new_signal": {
      "strong": [],
      "weak": []
    },
    "update": {
      "strong": [
        "стоп в бу",
        "стоп на 1 тейк",
        "стоп на первый тейк",
        "остаток закрываю по текущей цене",
        "дошли до 2-х тейков",
        "тейк взят",
        "вход исполнен",
        "entry filled",
        "переводим в бу",
        "перевод в безубыток",
        "стоп в безубыток",
        "выбило по стопу",
        "стоп сработал",
        "убираем лимитки",
        "отменяем лимитки",
        "лимитку на усреднение обязательно убираем",
        "закрываю по текущим",
        "закрываю все позиции",
        "частично закрываем",
        "фикс 50%",
        "взяли лимитку",
        "моя средняя",
        "итог",
        "результаты",
        "общий профит",
        "зафиксировать",
        "фиксация",
        "фиксируем",
        "зафиксировал",
        "не актуально"
      ],
      "weak": [
        "итого",
        "результат"
      ]
    },
    "info_only": {
      "strong": [
        "обзор",
        "часа начинаем",
        "час начинаем",
        "Давайте начинать"
      ],
      "weak": [
        "Через ",
        "минут начинаем",
        "марафона"
      ]
    }
  },
  "field_markers": {
    "entry": {
      "strong": [
        "entry a",
        "entry b",
        "вход с текущих",
        "entry",
        "вход:",
        "вход (a)",
        "вход (b)",
        "Вход (2-фазный)",
        "a (с текущих)",
        "a (лимит)",
        "b (усреднение)",
        "b (лимит)",
        "Вход лимиткой",
        "вход лимитным ордером"
      ],
      "weak": [
        "усреднение:"
      ]
    },
    "stop_loss": {
      "strong": [
        "sl:",
        "стоп:"
      ],
      "weak": []
    },
    "take_profit": {
      "strong": [
        "tp1:",
        "tp2:",
        "tp3:",
        "tp:",
        "тейк 1:",
        "тейк 2:",
        "тейк 3:",
        "цели:",
        "цель 1:",
        "цель 2:",
        "цель 3:"
      ],
      "weak": []
    }
  },
  "classification_rules": [
    {
      "name": "complete_new_signal_structure",
      "when_all_fields_present": [
        "entry",
        "stop_loss",
        "take_profit"
      ],
      "then": "new_signal",
      "score": 1.0
    },
    {
      "name": "partial_new_signal_structure",
      "when_all_fields_present": [
        "entry",
        "stop_loss"
      ],
      "then": "new_signal",
      "score": 0.7
    }
  ],
  "combination_rules": [
    {
      "if": [
        "вход",
        "sl:"
      ],
      "then": "new_signal",
      "confidence_boost": 0.4
    },
    {
      "if": [
        "стоп в бу",
        "тейк"
      ],
      "then": "update",
      "confidence_boost": 0.3
    }
  ],
  "intent_markers": {
    "MOVE_STOP_TO_BE": {
      "strong": [
        "стоп в бу",
        "стопы в бу",
        "стоп в безубыток",
        "стоп поставим на точку входа",
        "стоп на точку входа",
        "стоп должен стоять в безубытке",
        "стоп в безубытке",
        "стоп переводим в безубыток",
        "переводим в бу",
        "Стоп обязательно на точку входа",
        "поставить на точку входа",
        "стоп переводим в бу",
        "стоять в безубытке",
        "перевод в бу",
        "перевод в безубыток",
        "перевести стоп в безубыток",
        "стоп на вход",
        "стоп на цену входа",
        "стоп в ноль"
      ],
      "weak": [
        "бу",
        "безубыток",
        "точка входа",
        "на вход"
      ]
    },
    "MOVE_STOP": {
      "strong": [
        "стоп на 1 тейк",
        "стоп на первый тейк",
        "стоп на tp1",
        "move stop",
        "move sl",
        "переставить стоп",
        "переставляем стоп",
        "стоп переставляем",
        "стоп переносим",
        "перенос стопа",
        "сдвигаем стоп",
        "поднять стоп",
        "новый стоп",
        "update stop",
        "new sl",
        "стоп на первый тейк ставим",
        "стоп на 2 тейк",
        "стоп на второй тейк",
        "стоп переношу на"
      ],
      "weak": [
        "стоп на "
      ]
    },
    "CLOSE_FULL": {
      "strong": [
        "прикроем ее",
        "закрываю по текущей",
        "закрываю все позиции",
        "закрываю по текущим",
        "хочу зафиксировать",
        "зафиксировать все позиции",
        "зафиксировать все шорты",
        "зафиксировать все лонги",
        "фиксация 100%",
        "фиксация 100% по текущим отметкам",
        "давайте их прикроем",
        "закрываю на текущих",
        "Закрываю сделку",
        "закрываю полностью",
        "закрываем полностью",
        "закрываем позицию полностью",
        "закрываем сделку",
        "закрываю по рынку",
        "зафиксирую все свои позиции по текущим",
        "фиксирую все позиции",
        "закрываю",
        "прикроем",
        "фиксирую все",
        "закрыта",
        "закрою по текущим",
        "закрыть по текущим"
      ],
      "weak": []
    },
    "CLOSE_PARTIAL": {
      "strong": [
        "фикс 50%",
        "фиксирую 50%",
        "срежем 50%",
        "срезал 50%",
        "срезал еще 25%",
        "срезаем тут 50%",
        "частично закрываем",
        "частичная фиксация",
        "закрыть 80% позиции",
        "закрывать 80% позиции",
        "забираем часть",
        "сокращаем позицию"
      ],
      "weak": [
        "частично",
        "половину"
      ]
    },
    "CANCEL_PENDING_ORDERS": {
      "strong": [
        "уберем лимитки",
        "убираем лимитки",
        "отменяем лимитки",
        "снять все лимитные ордера",
        "снять лимитки",
        "снимаем лимитные ордера",
        "снимаем лимитки",
        "снять лимитные ордера",
        "убрать все лимитные ордера",
        "лимитку убираем",
        "Лимитку на усреднение убираем",
        "убираем лимтку",
        "убираем лимитку",
        "убрать лимитку",
        "отменяем лимитку",
        "отменить лимитки",
        "отменить лимитный ордер",
        "лимитку на усреднение обязательно убираем",
        "лимитку на усреднение убираем",
        "снимаем лимитку",
        "уберем лимитку"
      ],
      "weak": []
    },
    "INVALIDATE_SETUP": {
      "strong": [
        "тут отмена",
        "Отмена",
        "тоже отбой",
        "не актуально",
        "старый сигнал закрыт"
      ],
      "weak": []
    },
    "REENTER": {
      "strong": [
        "перезайдем",
        "перезаходим"
      ],
      "weak": []
    },
    "ADD_ENTRY": {
      "strong": [],
      "weak": []
    },
    "UPDATE_TAKE_PROFITS": {
      "strong": [
        "обновить тейки",
        "можно обновить тейки",
        "тейки обновить",
        "убираю 2 и 3 тейк",
        "добавлю тейк спота",
        "первый тейк убираем",
        "тейк убираем",
        "обновляем тейки",
        "новые тейки",
        "новые цели"
      ],
      "weak": []
    },
    "ENTRY_FILLED": {
      "strong": [
        "взяли лимитку",
        "лимитка взялась",
        "взяло лимитку",
        "ордер исполнен",
        "исполнилась",
        "усреднение взято",
        "взяли усреднение",
        "моя средняя"
      ],
      "weak": [
        "исполнилась",
        "средняя",
        "лимитка",
        "исполнен"
      ]
    },
    "TP_HIT": {
      "strong": [
        "дошли до 2-х тейков",
        "тейк взят",
        "1 тейк",
        "tp hit",
        "tp1 hit",
        "первый тейк",
        "2 тейка",
        "2 тейк",
        "второй тейк",
        "3 тейк",
        "3 тейка",
        "тейк взяли",
        "взяли тейк",
        "все тейки"
      ],
      "weak": [
        "tp1",
        "tp 1",
        "tp2",
        "tp 2",
        "tp3",
        "tp 3",
        "tp4",
        "tp 4",
        "тейк 1",
        "тейк 2",
        "тейк 3",
        "тейк"
      ]
    },
    "SL_HIT": {
      "strong": [
        "выбило по стопу",
        "стоп сработал",
        "словили стоп",
        "к сожалению стоп",
        "к сожалению стоп.",
        "увы стоп",
        "очень неприятный стоп",
        "очень не приятный стоп",
        "тут был стоп",
        "стоп был",
        "выбило стоп",
        "сработал стоп"
      ],
      "weak": [
        "стоп"
      ]
    },
    "EXIT_BE": {
      "strong": [
        "ушел в бу",
        "позиция ушла в бу",
        "остаток ушел в бу",
        "остаток позиции ушел в бу",
        "сделка закрылась в безубыток",
        "закрылось в безубыток",
        "закрылся в бу",
        "закрылась в бу",
        "закрыта в бу",
        "закрылись в бу",
        "также в бу закрылись",
        "в безубыток закрылся",
        "закрылась в безубыток",
        "закрылся в бу"
      ],
      "weak": [
        "бу",
        "безубыток",
        "breakeven"
      ]
    },
    "REPORT_FINAL_RESULT": {
      "strong": [
        "итог",
        "результаты",
        "общий профит",
        "профит по сделке",
        "чистыми",
        "чистого движения",
        "заработали",
        "сделка закрыта",
        "позиция закрыта",
        "сетап полностью закрыт",
        "все тейки, сделка закрыта",
        "поздравляю",
        "убыток",
        "профит",
        "итого",
        "результат"
      ],
      "weak": []
    },
    "REPORT_PARTIAL_RESULT": {
      "strong": [],
      "weak": []
    }
  },
  "side_markers": {
    "long": [
      "long",
      "лонг"
    ],
    "short": [
      "short",
      "шорт"
    ]
  },
  "market_context_markers": {
    "spot": [],
    "futures": [],
    "margin": []
  },
  "entry_order_markers": {
    "market": [
      "вход с текущих",
      "a (с текущих)"
    ],
    "limit": [
      "a (лимит)",
      "Вход лимиткой",
      "вход лимитным ордером",
      "лимитным ордером"
    ]
  },
  "target_markers": {
    "strong": {